{
  "api_version": "proof.dev/delegation/v2",
  "authority_sequence": 4,
  "previous_authority_record_digest": "blake3:21b5c6a02c3dd59eb1e139f4a5411a231efae10da7f51b00e28aa7c7c8403646",
  "delegation_id": "019c0000-0000-7000-8000-000000000005",
  "workspace_id": "019c0000-0000-7000-8000-000000000001",
  "delegation_profile": "proof.local/authority/direct/v1",
  "issuer_principal_id": "019c0000-0000-7000-8000-000000000002",
  "recipient_principal_id": "019c0000-0000-7000-8000-000000000003",
  "actions": [
    "context:build",
    "workspace:status"
  ],
  "scope": {
    "environment_ids": [
      "production"
    ],
    "object_ids": [
      "019c0000-0000-7000-8000-000000000020"
    ],
    "schema_ids": [],
    "locales": []
  },
  "constraints": {
    "max_objects": 100,
    "max_context_bytes": 1048576,
    "max_edits_per_changeset": 100,
    "allow_subdelegation": false
  },
  "not_before": "2026-08-17T20:01:00Z",
  "expires_at": "2026-08-18T20:01:00Z",
  "issued_at": "2026-08-17T20:01:00Z"
}
